{
 "frame": "away team mirrored (x' = 120 - x, y' = 80 - y); lines are in each team's own frame",
 "match_end_minute": 125,
 "window_minutes": 15,
 "windows": [
  {
   "id": "full",
   "label": "Full match",
   "start": 0,
   "end": 125,
   "kind": "full"
  },
  {
   "id": "p1",
   "label": "First half",
   "start": 0,
   "end": 45,
   "kind": "period"
  },
  {
   "id": "p2",
   "label": "Second half",
   "start": 45,
   "end": 90,
   "kind": "period"
  },
  {
   "id": "et",
   "label": "Extra time",
   "start": 90,
   "end": 125,
   "kind": "period"
  },
  {
   "id": "m0_15",
   "label": "0-15 min",
   "start": 0,
   "end": 15,
   "kind": "slide"
  },
  {
   "id": "m5_20",
   "label": "5-20 min",
   "start": 5,
   "end": 20,
   "kind": "slide"
  },
  {
   "id": "m10_25",
   "label": "10-25 min",
   "start": 10,
   "end": 25,
   "kind": "slide"
  },
  {
   "id": "m15_30",
   "label": "15-30 min",
   "start": 15,
   "end": 30,
   "kind": "slide"
  },
  {
   "id": "m20_35",
   "label": "20-35 min",
   "start": 20,
   "end": 35,
   "kind": "slide"
  },
  {
   "id": "m25_40",
   "label": "25-40 min",
   "start": 25,
   "end": 40,
   "kind": "slide"
  },
  {
   "id": "m30_45",
   "label": "30-45 min",
   "start": 30,
   "end": 45,
   "kind": "slide"
  },
  {
   "id": "m35_50",
   "label": "35-50 min",
   "start": 35,
   "end": 50,
   "kind": "slide"
  },
  {
   "id": "m40_55",
   "label": "40-55 min",
   "start": 40,
   "end": 55,
   "kind": "slide"
  },
  {
   "id": "m45_60",
   "label": "45-60 min",
   "start": 45,
   "end": 60,
   "kind": "slide"
  },
  {
   "id": "m50_65",
   "label": "50-65 min",
   "start": 50,
   "end": 65,
   "kind": "slide"
  },
  {
   "id": "m55_70",
   "label": "55-70 min",
   "start": 55,
   "end": 70,
   "kind": "slide"
  },
  {
   "id": "m60_75",
   "label": "60-75 min",
   "start": 60,
   "end": 75,
   "kind": "slide"
  },
  {
   "id": "m65_80",
   "label": "65-80 min",
   "start": 65,
   "end": 80,
   "kind": "slide"
  },
  {
   "id": "m70_85",
   "label": "70-85 min",
   "start": 70,
   "end": 85,
   "kind": "slide"
  },
  {
   "id": "m75_90",
   "label": "75-90 min",
   "start": 75,
   "end": 90,
   "kind": "slide"
  },
  {
   "id": "m80_95",
   "label": "80-95 min",
   "start": 80,
   "end": 95,
   "kind": "slide"
  },
  {
   "id": "m85_100",
   "label": "85-100 min",
   "start": 85,
   "end": 100,
   "kind": "slide"
  },
  {
   "id": "m90_105",
   "label": "90-105 min",
   "start": 90,
   "end": 105,
   "kind": "slide"
  },
  {
   "id": "m95_110",
   "label": "95-110 min",
   "start": 95,
   "end": 110,
   "kind": "slide"
  },
  {
   "id": "m100_115",
   "label": "100-115 min",
   "start": 100,
   "end": 115,
   "kind": "slide"
  },
  {
   "id": "m105_120",
   "label": "105-120 min",
   "start": 105,
   "end": 120,
   "kind": "slide"
  },
  {
   "id": "m110_125",
   "label": "110-125 min",
   "start": 110,
   "end": 125,
   "kind": "slide"
  }
 ],
 "data": {
  "full": {
   "home": {
    "players": [
     {
      "id": 2995,
      "name": "Ángel Di María",
      "jersey": 11,
      "role": "ATT",
      "x": 82.1,
      "y": 13.0,
      "n": 112
     },
     {
      "id": 3090,
      "name": "Nicolás Otamendi",
      "jersey": 19,
      "role": "DEF",
      "x": 38.3,
      "y": 24.0,
      "n": 201
     },
     {
      "id": 5503,
      "name": "Lionel Messi",
      "jersey": 10,
      "role": "ATT",
      "x": 77.1,
      "y": 51.9,
      "n": 199
     },
     {
      "id": 5507,
      "name": "Nicolás Tagliafico",
      "jersey": 3,
      "role": "DEF",
      "x": 57.4,
      "y": 9.6,
      "n": 134
     },
     {
      "id": 5743,
      "name": "Paulo Dybala",
      "jersey": 21,
      "role": "MID",
      "x": 62.5,
      "y": 24.5,
      "n": 10
     },
     {
      "id": 6909,
      "name": "Emiliano Martínez",
      "jersey": 23,
      "role": "GK",
      "x": 11.8,
      "y": 42.7,
      "n": 61
     },
     {
      "id": 7797,
      "name": "Rodrigo De Paul",
      "jersey": 7,
      "role": "MID",
      "x": 60.9,
      "y": 60.3,
      "n": 210
     },
     {
      "id": 11456,
      "name": "Lautaro Martínez",
      "jersey": 22,
      "role": "ATT",
      "x": 95.5,
      "y": 36.6,
      "n": 30
     },
     {
      "id": 16308,
      "name": "Leandro Paredes",
      "jersey": 5,
      "role": "MID",
      "x": 54.4,
      "y": 41.3,
      "n": 35
     },
     {
      "id": 19597,
      "name": "Marcos Acuña",
      "jersey": 8,
      "role": "ATT",
      "x": 78.6,
      "y": 10.5,
      "n": 89
     },
     {
      "id": 20572,
      "name": "Cristian Romero",
      "jersey": 13,
      "role": "DEF",
      "x": 33.9,
      "y": 51.4,
      "n": 175
     },
     {
      "id": 27886,
      "name": "Alexis MacAllister",
      "jersey": 20,
      "role": "MID",
      "x": 67.7,
      "y": 24.3,
      "n": 164
     },
     {
      "id": 28263,
      "name": "Gonzalo Montiel",
      "jersey": 4,
      "role": "DEF",
      "x": 66.4,
      "y": 69.9,
      "n": 41
     },
     {
      "id": 29201,
      "name": "Nahuel Molina",
      "jersey": 26,
      "role": "DEF",
      "x": 54.9,
      "y": 71.0,
      "n": 124
     },
     {
      "id": 29560,
      "name": "Julián Álvarez",
      "jersey": 9,
      "role": "ATT",
      "x": 80.0,
      "y": 39.1,
      "n": 101
     },
     {
      "id": 38718,
      "name": "Enzo Fernandez",
      "jersey": 24,
      "role": "MID",
      "x": 55.0,
      "y": 42.9,
      "n": 272
     }
    ],
    "lines": {
     "def": 50.2,
     "mid": 60.1,
     "att": 82.7
    },
    "shape": {
     "length": 32.5,
     "width": 61.4,
     "compact": 0.59,
     "label": "mid block"
    }
   },
   "away": {
    "players": [
     {
      "id": 2972,
      "name": "Marcus Thuram",
      "jersey": 26,
      "role": "MID",
      "x": 48.6,
      "y": 62.7,
      "n": 83
     },
     {
      "id": 3009,
      "name": "Kylian Mbappé",
      "jersey": 10,
      "role": "ATT",
      "x": 35.1,
      "y": 62.1,
      "n": 128
     },
     {
      "id": 3026,
      "name": "Adrien Rabiot",
      "jersey": 14,
      "role": "MID",
      "x": 55.7,
      "y": 52.4,
      "n": 135
     },
     {
      "id": 3099,
      "name": "Hugo Lloris",
      "jersey": 1,
      "role": "GK",
      "x": 106.7,
      "y": 41.5,
      "n": 66
     },
     {
      "id": 3604,
      "name": "Olivier Giroud",
      "jersey": 9,
      "role": "ATT",
      "x": 52.3,
      "y": 34.5,
      "n": 25
     },
     {
      "id": 4445,
      "name": "Jules Koundé",
      "jersey": 5,
      "role": "DEF",
      "x": 66.8,
      "y": 12.5,
      "n": 175
     },
     {
      "id": 5477,
      "name": "Ousmane Dembélé",
      "jersey": 11,
      "role": "ATT",
      "x": 50.3,
      "y": 10.1,
      "n": 37
     },
     {
      "id": 5485,
      "name": "Raphaël Varane",
      "jersey": 4,
      "role": "DEF",
      "x": 76.1,
      "y": 29.8,
      "n": 169
     },
     {
      "id": 5487,
      "name": "Antoine Griezmann",
      "jersey": 7,
      "role": "MID",
      "x": 54.0,
      "y": 37.9,
      "n": 83
     },
     {
      "id": 6704,
      "name": "Theo Hernández",
      "jersey": 22,
      "role": "DEF",
      "x": 57.1,
      "y": 72.7,
      "n": 127
     },
     {
      "id": 8217,
      "name": "Kingsley Coman",
      "jersey": 20,
      "role": "MID",
      "x": 43.4,
      "y": 25.3,
      "n": 51
     },
     {
      "id": 8519,
      "name": "Dayotchanculle Upamecano",
      "jersey": 18,
      "role": "DEF",
      "x": 74.1,
      "y": 53.9,
      "n": 180
     },
     {
      "id": 10481,
      "name": "Aurélien Tchouaméni",
      "jersey": 8,
      "role": "MID",
      "x": 60.9,
      "y": 41.3,
      "n": 173
     },
     {
      "id": 11135,
      "name": "Ibrahima Konaté",
      "jersey": 24,
      "role": "DEF",
      "x": 46.3,
      "y": 24.0,
      "n": 8
     },
     {
      "id": 11990,
      "name": "Youssouf Fofana",
      "jersey": 13,
      "role": "MID",
      "x": 60.1,
      "y": 50.7,
      "n": 29
     },
     {
      "id": 22097,
      "name": "Randal Kolo",
      "jersey": 12,
      "role": "ATT",
      "x": 41.4,
      "y": 30.2,
      "n": 77
     },
     {
      "id": 24778,
      "name": "Eduardo Camavinga",
      "jersey": 25,
      "role": "DEF",
      "x": 70.3,
      "y": 68.5,
      "n": 65
     }
    ],
    "lines": {
     "def": 54.9,
     "mid": 66.2,
     "att": 75.2
    },
    "shape": {
     "length": 20.3,
     "width": 62.5,
     "compact": 0.75,
     "label": "high line"
    }
   }
  },
  "p1": {
   "home": {
    "players": [
     {
      "id": 2995,
      "name": "Ángel Di María",
      "jersey": 11,
      "role": "ATT",
      "x": 83.8,
      "y": 10.6,
      "n": 93
     },
     {
      "id": 3090,
      "name": "Nicolás Otamendi",
      "jersey": 19,
      "role": "DEF",
      "x": 37.7,
      "y": 22.7,
      "n": 113
     },
     {
      "id": 5503,
      "name": "Lionel Messi",
      "jersey": 10,
      "role": "ATT",
      "x": 74.4,
      "y": 52.5,
      "n": 83
     },
     {
      "id": 5507,
      "name": "Nicolás Tagliafico",
      "jersey": 3,
      "role": "DEF",
      "x": 56.8,
      "y": 7.5,
      "n": 70
     },
     {
      "id": 6909,
      "name": "Emiliano Martínez",
      "jersey": 23,
      "role": "GK",
      "x": 10.8,
      "y": 43.1,
      "n": 26
     },
     {
      "id": 7797,
      "name": "Rodrigo De Paul",
      "jersey": 7,
      "role": "MID",
      "x": 61.1,
      "y": 57.9,
      "n": 103
     },
     {
      "id": 20572,
      "name": "Cristian Romero",
      "jersey": 13,
      "role": "DEF",
      "x": 33.7,
      "y": 49.9,
      "n": 106
     },
     {
      "id": 27886,
      "name": "Alexis MacAllister",
      "jersey": 20,
      "role": "MID",
      "x": 69.7,
      "y": 20.7,
      "n": 80
     },
     {
      "id": 29201,
      "name": "Nahuel Molina",
      "jersey": 26,
      "role": "DEF",
      "x": 52.3,
      "y": 70.2,
      "n": 61
     },
     {